{
  "schema": "wea.artifact/v1",
  "schema_version": "1.0.0",
  "kind": "Artifact",
  "artifact_id": "sha256:eeeeeeeeeeeeeeeeeeeeeeeeeeeeeeeeeeeeeeeeeeeeeeeeeeeeeeeeeeeeeeee",
  "media_type": "application/json",
  "logical_schema": "wea/Verification@1",
  "size_bytes": 128,
  "storage_ref": "cas-private://sha256/eeeeeeeeeeeeeeeeeeeeeeeeeeeeeeeeeeeeeeeeeeeeeeeeeeeeeeeeeeeeeeee",
  "producer": {
    "attempt_id": "11111111-1111-4111-8111-111111111111",
    "trace_id": "0123456789abcdef0123456789abcdef",
    "executor_digest": "sha256:1111111111111111111111111111111111111111111111111111111111111111",
    "instance_ref": {
      "instance_id": "sha256:cccccccccccccccccccccccccccccccccccccccccccccccccccccccccccccccc",
      "template_release": {
        "logical_id": "core/minimal-flow",
        "template_version": "1.0.0",
        "release_digest": "sha256:aaaaaaaaaaaaaaaaaaaaaaaaaaaaaaaaaaaaaaaaaaaaaaaaaaaaaaaaaaaaaaaa",
        "spec_digest": "sha256:bbbbbbbbbbbbbbbbbbbbbbbbbbbbbbbbbbbbbbbbbbbbbbbbbbbbbbbbbbbbbbbb"
      },
      "instance_spec_digest": "sha256:dddddddddddddddddddddddddddddddddddddddddddddddddddddddddddddddd"
    },
    "effects": {
      "read_scope": [
        "workspace://snapshot"
      ],
      "write_scope": [],
      "write_semantics": "none",
      "network_access": "deny",
      "external_side_effects": "none",
      "determinism": "deterministic",
      "replay_policy": "safe"
    }
  },
  "source_snapshot_digest": "sha256:cccccccccccccccccccccccccccccccccccccccccccccccccccccccccccccccc",
  "dependencies": {
    "root_digest": "sha256:6666666666666666666666666666666666666666666666666666666666666666",
    "negative_dependency_root": "sha256:7777777777777777777777777777777777777777777777777777777777777777",
    "completeness": "complete"
  },
  "claims": [
    {
      "name": "acceptance criteria passed",
      "evidence_digest": "sha256:8888888888888888888888888888888888888888888888888888888888888888"
    }
  ],
  "coverage": [
    "criterion:tests"
  ],
  "limitations": [],
  "security": {
    "classification": "internal",
    "taints": [],
    "allowed_consumers": [
      "project-a"
    ],
    "allowed_purposes": [
      "development"
    ]
  },
  "reuse_policy": {
    "publish_scope": "project",
    "allowed_cache_modes": [
      "EXACT"
    ]
  },
  "created_at": "2026-07-13T12:00:01Z",
  "expires_at": "2026-07-14T12:00:01Z"
}
